name,definition
Photosynthesis,"The process by which green plants and some other organisms use sunlight to synthesize nutrients from carbon dioxide and water."
Mitosis,"A type of cell division that results in two daughter cells each having the same number and kind of chromosomes as the parent nucleus."
Ecosystem,"A biological community of interacting organisms and their physical environment."
DNA,"Deoxyribonucleic acid, a self-replicating material present in nearly all living organisms as the main constituent of chromosomes."
Evolution,"The process by which different kinds of living organisms are thought to have developed and diversified from earlier forms during the history of the earth."
